{
  "enabled": true,
  "provider": "openai-codex",
  "models": {
    "classifier": ["gpt-5.4-mini"],
    "simple": ["gpt-5.4-mini"],
    "medium": ["gpt-5.4", "gpt-5.4-mini"],
    "complex": ["gpt-5.5", "gpt-5.4"]
  },
  "thinking": {
    "simple": "minimal",
    "medium": "low",
    "complex": "medium"
  },
  "classifier": {
    "enabled": true,
    "onlyWhenAmbiguous": true,
    "maxPromptChars": 4000,
    "maxEstimatedClassifierTokens": 1400,
    "minConfidence": 0.95
  },
  "telemetry": {
    "enabled": true,
    "maxEntries": 200,
    "rollupRetentionDays": 400
  },
  "memory": {
    "enabled": true,
    "inject": false,
    "maxFacts": 80,
    "maxInjectedChars": 1200,
    "maxFactChars": 240,
    "staleAfterDays": 30,
    "minContextTokensForInjection": 20000
  },
  "distillation": {
    "enabled": false,
    "minContextTokens": 80000,
    "repeatPromptThreshold": 3,
    "maxDigestChars": 1200
  },
  "tools": {
    "manage": false,
    "preserveCustomTools": true,
    "readOnlyTools": ["read", "grep", "find", "ls"],
    "writeTools": ["read", "grep", "find", "ls", "edit", "write", "bash"]
  },
  "routing": {
    "restoreModelAfterPrompt": true,
    "restoreThinkingAfterPrompt": true
  },
  "promptDiscipline": {
    "enabled": true,
    "maxAnswerBulletsSimple": 5
  },
  "promptSimplification": {
    "enabled": true,
    "compressionEnabled": true,
    "minCompressionSavingsTokens": 12,
    "maxClassifierPromptChars": 1600,
    "maxLineChars": 240,
    "headLines": 16,
    "tailLines": 16,
    "preserveSignalLines": 40
  },
  "ui": {
    "status": true,
    "notifyDecisions": true
  },
  "debug": {
    "dryRun": false,
    "trace": false,
    "verbose": false
  }
}
